Branch,Percentage_10th,Percentage_12th,Career_Goal,Course Type,Skills,Category,Title
ME,75,75,design engineer,Specialization,computeraided engineering cae manufacturing process management computed aided design computeraided manufacturing mechanical engineering autodesk engineering fusion computeraided design cad modeling simulation engineering design,Physical Science and Engineering,Autodesk CAD/CAM/CAE for Mechanical Engineering Specialization
CS,85,95,data scientist,Course,data sciencedata analysisdata visualization datavizr programming,Data Science,Data Visualization with R
MCA,75,65,software developer,Specialization,linux software design and architecture python programming git and github software development lifecycle sdlc basic programming concepts careers in software engineering programming languages and frameworks the software development lifecycle sdlc software architecture shell script bash unix shell,Computer Science,Applied Software Engineering Fundamentals Specialization
CSME,85,85,automation engineer,Specialization,json computer programming python programming sorting,Computer Science,Python 3 Programming Specialization
CS,85,95,cybersecurity analyst,Specialization,cloud services general data protection regulation gdpr cybersecurity contract law cloud computing intellectual property contract negotiations cybersecurity regulation international transfers of personal data competition law law enforcement access tax,Social Sciences,Cloud Computing Law Specialization
CSIT,85,85,web developer,Course,uipathstudioautomationworkflowrpa,Computer Science,RPA Basics and Introduction to UiPath
CS,85,95,cybersecurity analyst,Course,renewable energyproject executionproject operationsproject feasibilityproject management,Physical Science and Engineering,Renewable Energy Projects
IT,85,85,cloud engineer,Specialization,system administration red hat enterprise linux virtualization ibm power systems cloud computing red hat linux linux ibm powervc infrastructure as a service openstack ibm cloud,Information Technology,Linux and Private Cloud Administration on IBM Power Systems Specialization
ECE,85,95,iot developer,Course,risk managementoperations managementcorruptionstrategic planning,Business,What is Corruption: Anti-Corruption and Compliance
CSIT,85,95,data scientist,Specialization,data analysis microsoft excel data visualization dataviz presentation datainformed decisionmaking big data pivot table data cleansing dashboard business data virtualization communication presentation design,Business,Data Analysis and Presentation Skills: the PwC Approach Specialization
MCA,65,50,data analyst,Specialization,data science machine learning github r programming exploratory data analysis rstudio data analysis debugging data manipulation regular expression regex data cleansing cluster analysis,Data Science,Data Science: Foundations using R Specialization
CSIT,85,85,devops engineer,Course,cyberattacksnetwork securitythreat,Information Technology,Network Security
CS,85,85,cybersecurity analyst,Course,data sciencemachine learningr programmingnatural language processing,Data Science,Data Science Capstone
CSIT,85,95,web developer,Specialization,jquery web application development hypertext preprocessor php javascript mysql html cascading style sheets css phpmyadmin relational database sql create read update and delete,Computer Science,Web Applications for Everybody Specialization
CS,85,95,cybersecurity analyst,Course,data warehousingmicrostrategydata warehousesql,Data Science,Design and Build a Data Warehouse for Business Intelligence Implementation
ECE,85,85,vlsi engineer,Course,understand operational risk key risk indicators krisunderstand operational risk scenario analysiscalculate operational risk capital,Business,Operational Risk Management: Frameworks & Strategies
IT,75,85,web developer,Course,computer programmingproblem solvingmatlabprogramming language,Computer Science,Introduction to Programming with MATLAB
ECE,85,85,iot developer,Specialization,short story writing fiction writing creativity copy editing,Arts and Humanities,Creative Writing Specialization
ECE,85,75,signal processing engineer,Course,understand the likely impacts on the real economy of the different courses of actions ahead of usevaluate projects on a portfolio basis the economic attractiveness of various abatement projectsassess critically the economic desirability of different technologically feasible abatement technologiesunderstand the various policy approaches involved in the transition to a low carbon economy including in particular cap trade carbon markets,Social Sciences,Economics and Policies of Climate Change
IT,85,85,cloud engineer,Course,cloud storagedata storegoogle cloud platformcloud computing,Computer Science,Getting Started With Application Development
MCA,75,65,software developer,Specialization,hypothesisdriven development product management design thinking agile lean startup productmarket fit innovation pipeline agile user stories user experience design uxd agile software development software development usability testing,Computer Science,Digital Product Management Specialization
CSIT,85,85,devops engineer,Specialization,data analysis microsoft excel data visualization dataviz presentation datainformed decisionmaking big data pivot table data cleansing dashboard business data virtualization communication presentation design,Business,Data Analysis and Presentation Skills: the PwC Approach Specialization
CS,85,75,cybersecurity analyst,Course,business intelligencedata analysisdata visualization datavizmicrostrategy,Data Science,"Business Intelligence Concepts, Tools, and Applications"
ECE,85,75,signal processing engineer,Course,logicmathematicscalculus,Math and Logic,Introduction to Calculus
MCA,65,50,web developer,Course,logical controlsadministrative controlsphysical controls,Information Technology,Access Control Concepts
CSIT,85,85,web developer,Course,marketingsocial media marketingmarketing mixpublic relationspromotional mix,Business,"Comunicaciones integradas de marketing: Publicidad, Relaciones Públicas, Marketing Digital y más"
CSIT,85,85,data scientist,Course,regression analysisdata cleansingpredictive modellingexploratory data analysis,Data Science,Predictive Modeling and Analytics 
IT,85,75,data analyst,Specialization,data science data management data analysis communication leadership machine learning project team building management team management interpretation exploratory data analysis,Data Science,Executive Data Science Specialization
CS,85,95,ai engineer,Specialization,data clustering algorithms machine learning classification algorithms decision tree python programming machine learning concepts deep learning linear regression ridge regression lasso statistics regression analysis logistic regression,Data Science,Machine Learning Specialization
ECE,85,75,signal processing engineer,Specialization,convulsion data transmission audio processing ipython fourier analysis,Physical Science and Engineering,Digital Signal Processing Specialization
CS,85,95,data scientist,Course,data analysiscommunicationinterpretationexploratory data analysis,Business,Managing Data Analysis
CS,85,95,data scientist,Course,python programmingtableau softwaredata visualization datavizeffective communicationexploratory data analysis,Data Science,Go Beyond the Numbers: Translate Data into Insights
CS,85,85,machine learning engineer,Specialization,machine learning regression machine learning classification machine learning unsupervised learning exploratory data analysis artificial intelligence ai feature engineering statistical hypothesis testing regression analysis supervised learning linear regression ridge regression,Data Science,IBM Introduction to Machine Learning Specialization
CS,75,85,data scientist,Specialization,text mining python programming pandas matplotlib numpy data cleansing data virtualization data visualization dataviz machine learning ml algorithms machine learning scikitlearn natural language toolkit nltk,Data Science,Applied Data Science with Python Specialization
CSAI,85,95,robotics engineer,Course,linear regressiontime serieseconometricsregression analysis,Data Science,Econometrics: Methods and Applications
CS,85,85,ai engineer,Course,english grammarpunctuationgrammarwriting,Language Learning,Grammar and Punctuation
ECE,85,85,vlsi engineer,Course,customer developmentproduct developmentmarketingproduct managementleadership,Business,Product Management Essentials
CSIT,85,85,data scientist,Course,data sciencedeep learningartificial intelligence aijobsmachine learning,Data Science,Introduction to Artificial Intelligence (AI)
CS,85,75,cybersecurity analyst,Course,digital transformationdigital marketingcontent marketingdigital strategydigital research,Business,Digital Strategy and Business Opportunity
CSIT,85,95,web developer,Specialization,web development cascading style sheets css html javascript responsive web design web design web accessibility html style sheets document object model dom bootstrap frontend framework,Computer Science,Web Design for Everybody: Basics of Web Development & Coding Specialization
ECE,85,95,signal processing engineer,Course,text analysisbasic time series analysismachine learning model evaluation and optimizationpython programmingmachine learning modeling,Data Science,Machine Learning for Accounting with Python
CSIT,85,95,data scientist,Specialization,data science data analysis data visualization dataviz reproducible research,Data Science,Data Visualization & Dashboarding with R Specialization
CSIT,85,85,devops engineer,Course,gestión de proyectoscultura de la organizaciónpensamiento estratégicodesarrollo profesionalgestión de cambios,Business,Fundamentos de la gestión de proyectos
CSAI,85,85,robotics engineer,Course,presenting data insightstableau softwaredata visualization datavizeffective communicationdashboarding and reporting,Data Science,"Decisions, Decisions: Dashboards and Reports"
CSIT,85,85,web developer,Course,cloud computing securityartificial intelligence aimicrosoft azureinternet of things iot,Information Technology,Microsoft Azure Management Tools and Security Solutions
IT,85,85,web developer,Course,jsonxmlpython programmingweb scraping,Computer Science,Using Python to Access Web Data
MCA,50,50,data analyst,Course,python programmingdata virtualizationdata visualization datavizmatplotlib,Data Science,"Applied Plotting, Charting & Data Representation in Python"
CS,85,95,data scientist,Specialization,data science artificial intelligence ai information technology it architecture data architecture leadership deep learning jobs machine learning big data data mining management analytics,Data Science,IBM AI Foundations for Business Specialization
CSIT,85,85,data scientist,Specialization,data science relational database management system rdbms cloud databases python programming sql deep learning machine learning big data data mining github jupyter notebooks rstudio,Data Science,Introduction to Data Science Specialization
IT,85,85,web developer,Specialization,social return on investment sroi corruption social entrepreneurship socially responsible investing global financial crisis trend analysis economy trading strategic management,Business,Business Strategies for A Better World Specialization
CS,85,95,data scientist,Course,data warehousingmicrostrategydata warehousesql,Data Science,Design and Build a Data Warehouse for Business Intelligence Implementation
CS,85,85,data scientist,Course,data sciencedata analysissqlitesql,Data Science,SQL for Data Science
CSIT,85,95,data scientist,Specialization,data science python programming data analysis pandas numpy jupyter notebooks predictive modelling data visualization dataviz model selection dashboards and charts dash matplotlib,Data Science,Applied Data Science Specialization
CS,85,95,cybersecurity analyst,Specialization,threat intelligence digital forensics data breach cybersecurity analyst computer security incident management scripting forensics penetration test cybersecurity application security network defensive tactics security analyst,Information Technology,Security Analyst Fundamentals Specialization
CSIT,85,85,devops engineer,Course,derivativesswaps and optionsfixed incomebinomial distributionblack scholes model,Business,Introduction to Financial Engineering and Risk Management
CS,85,85,software engineer,Course,cluster analysisggplotr programmingexploratory data analysis,Data Science,Exploratory Data Analysis
IT,85,75,web developer,Professional Certificate,data sciencedatabase dbmsnosqlsqldatabase db designdatabase architecturepostgresqlmysqlrelational database management system rdbmscreate read update and deletedata analysisshell scriptbash unix shelllinuxdatabase serversrelational databasedatabase securitydatabase administrationextraction transformation and loading etlapache kafkaapache airflowdata pipelinesdata warehousingcube and rollupbusiness intelligence bistar and snowflake schemacognos analyticsoltp databases,Information Technology,IBM Data Warehouse Engineer Professional Certificate
IT,85,85,software engineer,Specialization,lean software development kanban agile software development software development process software development kit sdk scrum software development application security software architecture software testing software design software quality,Computer Science,Software Development Lifecycle Specialization
IT,85,75,data analyst,Specialization,data science spreadsheet microsoft excel data analysis data visualization dataviz pivot table ibm cognos analytics dashboard,Data Science,Data Analysis and Visualization Foundations Specialization
CSIT,85,75,software engineer,Course,data analysismicrosoft excelstatistical hypothesis testing,Data Science,Business Applications of Hypothesis Testing and Confidence Interval Estimation 
ECE,85,75,signal processing engineer,Specialization,image segmentation matlab object detection image processing video processing region analysis image filtering,Physical Science and Engineering,Image Processing for Engineering and Science Specialization
ECE,75,75,embedded systems engineer,Course,artificial intelligence aimachine learningreinforcement learningfunction approximationintelligent systems,Data Science,Prediction and Control with Function Approximation
EN,85,85,power systems engineer,Course,deep learningapplication programming interfaces apiartificial intelligence aimachine learningwatson,Data Science,Getting Started with AI using IBM Watson
CSIT,85,85,web developer,Course,management stylesleadershipmanagementorganizational culture,Business,Organizational Behavior: How to Manage People
CS,85,95,data scientist,Course,data analysiscommunicationinterpretationexploratory data analysis,Business,Managing Data Analysis
CSME,85,85,automation engineer,Specialization,appsheet google sheets nocode application development appsheet automation navigate the appsheet ui and editor to build an app learn the process to deploy and publish an app understand the capabilities of the appsheet nocode app development platform work with app data sources using google sheets create and customize the user experience of an app using appsheet views and branding app behaviors and automation application and data access control app authoring and collaboration,Information Technology,Building No-Code Apps with AppSheet Specialization
MCA,85,85,database administrator,Course,data modelbig datadata modelingdata management,Data Science,Big Data Modeling and Management Systems
CSIT,85,95,data scientist,Course,data warehousingmicrostrategydata warehousesql,Data Science,Design and Build a Data Warehouse for Business Intelligence Implementation
IT,85,75,web developer,Course,vectorsfilesstringsccomputer science,Computer Science,"C++ Basic Structures: Vectors, Pointers, Strings, and Files"
ECE,85,85,vlsi engineer,Project,database dbmsgoogle cloud platformmysql,Information Technology,Migrating to Cloud SQL from Amazon RDS for MySQL Using Database Migration Service
CSIT,85,85,data scientist,Course,data sciencedeep learningartificial intelligence aijobsmachine learning,Data Science,Introduction to Artificial Intelligence (AI)
ECE,85,85,vlsi engineer,Course,scipy and scikitlearnmachine learningregressionclassificationhierarchical clustering,Data Science,Machine Learning with Python
CS,85,95,data scientist,Specialization,describe how to work with relational data on azure describe core data concepts describe how to work with nonrelational data on azure describe an analytics workload on azure microsoft azure data management data storage data concepts database dbms nosql sql relational data,Data Science,Microsoft Azure Data Fundamentals DP-900 Exam Prep Specialization
CSAI,85,85,robotics engineer,Course,processing paymentspayment processingpayment technologyvalue propositionspayment systems,Business,The Future of Payment Technologies
CS,85,75,machine learning engineer,Specialization,model interpretation image segmentation natural language extraction machine learning timetoevent modeling deep learning model evaluation multiclass classification random forest model tuning treatment effect estimation machine learning interpretation,Data Science,AI for Medicine Specialization
CS,85,85,ai engineer,Specialization,vertex ai machine learning feature engineering tensorflow cloud computing application programming interfaces api inclusive ml google cloud platform bigquery data cleansing python programming build input data pipeline,Data Science,Machine Learning on Google Cloud Specialization
CS,85,85,machine learning engineer,Course,professionalemail writingcommunicationwriting,Language Learning,Write Professional Emails in English
CS,75,75,software engineer,Course,data analysismicrosoft excelpivot tabledata cleansing,Data Science,Problem Solving with Excel 
ECE,85,75,signal processing engineer,Specialization,product cost analysis project valuation financial statement analysis discounted cash flow analysis financial adviser time value of money cost estimation techniques application to personal finances project valuation npv irr and payback period creating a compelling project business case project selection techniques risk management scenario and sensitivity analysis,Business,Finance for Technical Managers Specialization
MCA,75,65,software developer,Course,python programmingnumpypandasdata cleansing,Data Science,Introduction to Data Science in Python
ECE,85,75,signal processing engineer,Course,organization designstrategic managementbusiness strategyorganizational structure,Business,Strategic Organization Design
CSIT,85,85,devops engineer,Course,saving moneysetting financial goalspaying for collegeplanning for retirementretirement savings,Personal Development,Saving Money for the Future
MCA,50,50,data analyst,Course,data analysispython programmingmachine learningdata visualization dataviz,Data Science,Data Analytics in Accounting Capstone
CSIT,85,95,data scientist,Specialization,big data neoj mongodb apache spark apache hadoop mapreduce cloudera data model data modeling data management splunk machine learning concepts,Data Science,Big Data Specialization
CS,85,85,cybersecurity analyst,Specialization,preattck python programming cybersecurity attack and defend computer programming introduction to python for cybersecurity persistence privilege escalation and evasion execution active defense,Information Technology,Python for Cybersecurity Specialization
IT,75,85,software engineer,Course,evaluation designvisualizing data with altairusercentered design create basic visualizations that match data and user needstask analysis define elements of a data analysis andor communication problem,Data Science,Fundamentals of Data Visualization
CSME,85,85,automation engineer,Specialization,software testing android software development java programming junit logic programming android studio objectoriented programming oop computer programming concurrent computing unit testing,Computer Science,Android App Development Specialization
ECE,85,85,vlsi engineer,Specialization,artificial intelligence ai digital design manufacturing engineer industry,Physical Science and Engineering,Digital Manufacturing & Design Technology  Specialization
CSIT,85,95,data scientist,Specialization,data science data management data analysis communication leadership machine learning project team building management team management interpretation exploratory data analysis,Data Science,Executive Data Science Specialization
CS,85,95,data scientist,Specialization,big data machine learning deep learning health care graphs unsupervised learning autoencoder,Data Science,Deep Learning for Healthcare Specialization
MCA,75,65,software developer,Professional Certificate,data sciencedeep learningmachine learningbig datadata mininggithubpython programmingjupyter notebooksrstudiomethodologycrispdmdata analysispandasnumpycloud databasesrelational database management system rdbmssqlpredictive modellingdata visualization datavizmodel selectiondashboards and chartsdashmatplotlibscipy and scikitlearnregressionclassificationhierarchical clusteringjupyter notebookdata science methodologykmeans clustering,Data Science,IBM Data Science Professional Certificate
CSAI,85,95,robotics engineer,Course,creative writingnovel writingstory telling,Arts and Humanities,Write Your First Novel
CS,85,95,cybersecurity analyst,Course,data sciencemethodologycrispdmdata analysisdata mining,Data Science,Data Science Methodology
ECE,85,95,signal processing engineer,Course,adobe photoshopadobe indesigngraphicscolor theory,Arts and Humanities,Brand New Brand
CS,85,85,cybersecurity analyst,Course,reformer modelsneural machine translationchatterbottbert modelsattention models,Data Science,Natural Language Processing with Attention Models
ECE,85,85,vlsi engineer,Course,artificial intelligence aiinnovation strategiesdesign thinkingtheories of creativitycomputational creativity,Computer Science,Natural Creativity
ECE,85,75,signal processing engineer,Course,django template languageget postobjectoriented programming oopcrosssite scripting forgery csrfdjango web framework,Computer Science,Building Web Applications in Django
CSIT,85,95,web developer,Professional Certificate,linuxcloud hostingweb developmentbash unix shellpython programmingapplication programming interfaces apicomputer programmingdjango web framework,Computer Science,Desarrollador back-end de Meta Professional Certificate
CS,85,95,data scientist,Specialization,storyboarding map tableau software data visualization dataviz data virtualization visualization computer graphics data analysis visual analytics interactive visualization,Data Science,Data Visualization with Tableau Specialization
CS,85,95,data scientist,Course,data warehousingmicrostrategydata warehousesql,Data Science,Design and Build a Data Warehouse for Business Intelligence Implementation
CS,85,95,software engineer,Course,data analysistableau softwaredata visualization datavizvisualization computer graphics,Data Science,Data Visualization and Communication with Tableau
CS,85,85,data scientist,Specialization,text mining python programming pandas matplotlib numpy data cleansing data virtualization data visualization dataviz machine learning ml algorithms machine learning scikitlearn natural language toolkit nltk,Data Science,Applied Data Science with Python Specialization
CS,75,85,data scientist,Specialization,data science machine learning github r programming exploratory data analysis rstudio data analysis debugging data manipulation regular expression regex data cleansing cluster analysis,Data Science,Data Science: Foundations using R Specialization
CSIT,75,85,devops engineer,Course,agile software developmentscrum methodologyzenhubkanbansprint planning,Computer Science,Introduction to Agile Development and Scrum
CSIT,85,95,devops engineer,Course,domain name system dnsipvnetwork modeltroubleshooting,Information Technology,The Bits and Bytes of Computer Networking
CS,75,85,data scientist,Course,data sciencedeep learningartificial intelligence aijobsmachine learning,Data Science,Introduction to Artificial Intelligence (AI)
CSIT,85,85,devops engineer,Course,income statementfinancial ratiofinancial statementbalance sheet,Business,Understanding Financial Statements: Company Performance
IT,75,75,data analyst,Professional Certificate,data scienceregression modelspredictive modellingexploratory data analysis edastatistical analysismachine learningpython programmingdata analysisjupyter notebooktableau softwaredata visualization datavizkaggle,Data Science,Google Advanced Data Analytics Professional Certificate
MCA,85,65,data analyst,Course,data sciencespreadsheetmicrosoft exceldata analysispivot table,Data Science,Excel Basics for Data Analysis
CSIT,85,85,devops engineer,Course,interactivityplotlyweb applicationr programming,Data Science,Developing Data Products
CSIT,85,95,devops engineer,Specialization,problem solving performance disease flow network environmental impact assessment sustainability environmental health diets motivation,Health,Healthy and Sustainable Foods and Products Specialization
ECE,85,85,vlsi engineer,Course,metamask clientblockchaindecentralized applicationstruffle idesmart contract,Computer Science,Decentralized Applications (Dapps)
CSIT,85,75,web developer,Specialization,json xml python programming database dbms python syntax and semantics basic programming language computer programming data structure tuple web scraping sqlite sql,Computer Science,Python for Everybody Specialization
CSIT,85,85,data scientist,Specialization,codeskulptor data analysis python programming data visualization dataviz python syntax and semantics debugging tuple list label,Computer Science,Introduction to Scripting in Python Specialization
IT,85,75,web developer,Specialization,computer graphics cg problem solving mathematics javascript computer programming,Computer Science,Introduction to Computer Science and Programming Specialization
