Branch,Percentage_10th,Percentage_12th,Career_Goal,Course Type,Skills,Category,Title
CSIT,85,85,data scientist,Course,data sciencespreadsheetmicrosoft exceldata analysisdata visualization dataviz,Data Science,Introduction to Data Analytics
CS,85,75,cybersecurity analyst,Specialization,cloud services general data protection regulation gdpr cybersecurity contract law cloud computing intellectual property contract negotiations cybersecurity regulation international transfers of personal data competition law law enforcement access tax,Social Sciences,Cloud Computing Law Specialization
CSME,85,85,product design engineer,Course,product developmentprototypingproduct managementproduct designuser experience ux,Business,"Creative Design, Prototyping, and Testing"
CS,65,65,machine learning engineer,Specialization,data science relational database management system rdbms cloud databases python programming sql deep learning machine learning big data data mining github jupyter notebooks rstudio,Data Science,Introduction to Data Science Specialization
CS,85,95,software engineer,Course,data sciencegithubpython programmingjupyter notebooksrstudio,Data Science,Tools for Data Science
CS,75,75,software engineer,Specialization,data clustering algorithms text mining data visualization dataviz data mining data visualization software tableau software data virtualization information retrieval ir document retrieval machine learning recommender systems probabilistic models,Data Science,Data Mining  Specialization
ECE,85,85,signal processing engineer,Professional Certificate,tableursvisualisation des données datavizsqlnettoyage des donnéesanalyse de donneesprise de décisionrésolution de problèmesquestionnementcollecte de donnéeséthique des donnéesmétadonnéesdétermination de la taille déchantillonfeuille de calculintégrité des donnéesanalyse des donnéesagrégation des donnéescalculs de donnéespresentationlogiciel tableauprogrammation rr markdownrstudioportfolio pour la recherche demploiétude de cas,Data Science,Google Data Analytics Professional Certificate
ECE,85,85,vlsi engineer,Course,warehouse managementlogistics planningsupply chaininventory,Business,Supply Chain Logistics
CS,85,85,cybersecurity analyst,Course,teachingdiversityinclusiveteaching strategies,Social Sciences,Uncommon Sense Teaching
CS,85,75,machine learning engineer,Specialization,data science internet of things iot deep learning apache spark statistics machine learning long shortterm memory istm,Data Science,Advanced Data Science with IBM Specialization
ECE,85,95,iot developer,Specialization,financial mismanagement financial management risk management investment financial aid management financial accounting accounting accrual financial statement cash flow cash flow statement stock,Business,Financial Management Specialization
CS,85,95,data scientist,Specialization,data science spreadsheet microsoft excel data analysis data visualization dataviz pivot table ibm cognos analytics dashboard,Data Science,Data Analysis and Visualization Foundations Specialization
CSIT,85,75,software engineer,Course,data sciencespreadsheetmicrosoft exceldata analysispivot table,Data Science,Excel Basics for Data Analysis
ECE,85,75,signal processing engineer,Course,economicsconsumer behavioursupply and demandcost,Business,Firm Level Economics: Consumer and Producer Behavior
CSIT,85,85,data scientist,Specialization,storyboarding map tableau software data visualization dataviz data virtualization visualization computer graphics data analysis visual analytics interactive visualization,Data Science,Data Visualization with Tableau Specialization
CS,85,85,data scientist,Specialization,machine learning python programming data visualization dataviz data preparation exploratory data analysis data analysis predictive analytics data architecture coding linear regression sql text analysis,Data Science,Accounting Data Analytics Specialization
CS,85,85,ai engineer,Course,modelingproject managementmachine learning,Data Science,Managing Machine Learning Projects
CS,65,65,machine learning engineer,Professional Certificate,manage azure resources for machine learningdeploy and operationalize machine learning solutionsrun experiments and train modelsimplement responsible machine learning,Computer Science,Microsoft Azure Data Scientist Associate (DP-100)  Professional Certificate
IT,75,75,data analyst,Course,data analysistableau softwaredata virtualizationdata visualization dataviz,Data Science,Essential Design Principles for Tableau
IT,75,85,web developer,Specialization,web development cascading style sheets css html javascript responsive web design web design web accessibility html style sheets document object model dom bootstrap frontend framework,Computer Science,Web Design for Everybody: Basics of Web Development & Coding Specialization
CS,85,85,data scientist,Specialization,data science data analysis machine learning spark sql sql databricks,Data Science,Data Science with Databricks for Data Analysts Specialization
CS,85,85,ai engineer,Specialization,artificial neural network convolutional neural network tensorflow recurrent neural network transformers deep learning backpropagation python programming neural network architecture mathematical optimization hyperparameter tuning inductive transfer,Data Science,Deep Learning Specialization
ECE,85,75,signal processing engineer,Course,dyslexiaeducationreadinglawlearning,Health,Overcoming Dyslexia
IT,75,85,software engineer,Course,data manipulationregular expression regexr programmingdata cleansing,Data Science,Getting and Cleaning Data
IT,85,85,cloud engineer,Project,cloud computing securitydatabase dbmsgoogle cloud platform,Information Technology,Securing a Cloud SQL for PostgreSQL Instance
CSIT,85,85,devops engineer,Course,accountingfinancial analysisfinancial statementfinance,Business,Financial Analysis of Organizations
CSIT,75,85,devops engineer,Course,nutritionorganic foodfood safetyfood science,Health,Child Nutrition and Cooking
IT,75,85,software engineer,Specialization,linux software design and architecture python programming git and github software development lifecycle sdlc basic programming concepts careers in software engineering programming languages and frameworks the software development lifecycle sdlc software architecture shell script bash unix shell,Computer Science,Applied Software Engineering Fundamentals Specialization
MCA,85,65,data analyst,Course,data sciencer programming,Data Science,Introduction to R Programming for Data Science
EN,85,85,power systems engineer,Course,fundraisingcustomer relationship management crmmanagementmarketing,Business,Arts and Heritage Management
CS,85,85,data scientist,Specialization,data science python programming data analysis pandas numpy jupyter notebooks predictive modelling data visualization dataviz model selection dashboards and charts dash matplotlib,Data Science,Applied Data Science Specialization
IT,85,85,web developer,Course,web servicemicroservicesrepresentational state transfer restserviceoriented architecture,Computer Science,Service-Oriented Architecture
IT,75,75,data analyst,Course,data visualization softwaretableau softwaredata virtualizationdata visualization dataviz,Data Science,Data Visualization
ECE,85,75,signal processing engineer,Course,spring frameworkspring configuration techniquesinversion of controldependency injectionjunit,Computer Science,Spring - Ecosystem and Core
CSIT,85,85,devops engineer,Course,renewable energyproject executionproject operationsproject feasibilityproject management,Physical Science and Engineering,Renewable Energy Projects
CSIT,85,85,devops engineer,Course,framingvideo productionstorytellingvideo,Personal Development,Ready to Roll – The Video Production Process
CS,85,75,cybersecurity analyst,Course,data managementcloud integrationdata securityautomationcloud computing,Business,Salesforce Basics
CSIT,85,85,devops engineer,Course,performance appraisalhuman resources hrperformance managementorganizational culture,Business,Managing Employee Performance
CSIT,85,85,data scientist,Specialization,data science data analysis machine learning spark sql sql databricks,Data Science,Data Science with Databricks for Data Analysts Specialization
CS,75,85,data scientist,Specialization,data clustering algorithms text mining data visualization dataviz data mining data visualization software tableau software data virtualization information retrieval ir document retrieval machine learning recommender systems probabilistic models,Data Science,Data Mining  Specialization
MCA,75,65,software developer,Course,geographic information system gisdata analysisprojectmap analysisproject management,Data Science,Geospatial Analysis Project
CSIT,85,95,web developer,Course,python programmingdatabase dbmssqlitesql,Computer Science,Using Databases with Python
CS,85,95,cybersecurity analyst,Course,graph theoryneojanalyticsgraph database,Data Science,Graph Analytics for Big Data
MCA,65,50,data analyst,Course,data sciencespreadsheetmicrosoft exceldata analysisdata visualization dataviz,Data Science,Introduction to Data Analytics
ECE,85,75,signal processing engineer,Specialization,convulsion data transmission audio processing ipython fourier analysis,Physical Science and Engineering,Digital Signal Processing Specialization
MCA,75,65,software developer,Course,cloud databasespython programmingjupyter notebooksrelational database management system rdbmssql,Data Science,Databases and SQL for Data Science with Python
ECE,75,95,signal processing engineer,Specialization,describe fundamental principles of machine learning on azure describe ai workloads and considerations describe features of conversational ai workloads on azure describe features of computer vision workloads on azure describe features of natural language processing nlp workloads on azure artificial intelligence ai microsoft azure machine learning computer vision natural language processing test preparation,Data Science,Microsoft Azure AI Fundamentals AI-900 Exam Prep Specialization
IT,85,75,web developer,Specialization,json xml python programming database dbms python syntax and semantics basic programming language computer programming data structure tuple web scraping sqlite sql,Computer Science,Python for Everybody Specialization
IT,85,75,web developer,Specialization,jquery web application development hypertext preprocessor php javascript mysql html cascading style sheets css phpmyadmin relational database sql create read update and delete,Computer Science,Web Applications for Everybody Specialization
CS,75,75,software engineer,Specialization,programming principles python programming java programming data structure computer programming python tools python syntax and semantics data science python libraries data analysis data visualization dataviz java tools,Computer Science,Introduction to Programming with Python and Java Specialization
CS,85,85,ai engineer,Specialization,data science digital transformation artificial intelligence ai business strategy cloud computing deep learning jobs machine learning strategy swot analysis value proposition competitiveness,Data Science,IBM & Darden Digital Strategy Specialization
ECE,85,85,vlsi engineer,Course,advertisinglogobrandbrand identity,Business,Brand Identity and Strategy
CS,85,75,machine learning engineer,Course,random forestmachine learning ml algorithmsmachine learningr programming,Data Science,Practical Machine Learning
CS,85,85,data scientist,Specialization,data collection cluster sampling r programming missing data data quality data analysis data generating process,Data Science,Survey Data Collection and Analytics  Specialization
CSIT,85,85,web developer,Course,web designhtmljavascriptcascading style sheets css,Computer Science,Web Design for Everybody Capstone
CS,85,85,software engineer,Course,data sciencemethodologycrispdmdata analysisdata mining,Data Science,Data Science Methodology
ECE,75,75,iot developer,Course,serial line internet protocol sliproboticsrobotmatlab,Physical Science and Engineering,Robotics: Mobility
CS,85,95,data scientist,Specialization,data science data analysis data visualization dataviz reproducible research,Data Science,Data Visualization & Dashboarding with R Specialization
CS,85,85,data scientist,Course,data analysissimulationbusiness analyticsmathematical optimization,Data Science,Business Analytics for Decision Making
CS,85,85,data scientist,Course,data analysissimulationbusiness analyticsmathematical optimization,Data Science,Business Analytics for Decision Making
IT,85,85,cloud engineer,Course,tensorflowbigquerygoogle cloud platformcloud computing,Data Science,Google Cloud Big Data and Machine Learning Fundamentals 日本語版
CS,85,95,data scientist,Specialization,storyboarding map tableau software data visualization dataviz data virtualization visualization computer graphics data analysis visual analytics interactive visualization,Data Science,Data Visualization with Tableau Specialization
CSIT,85,85,devops engineer,Course,team buildingcultural learningleadershiporganizational culture,Business,The Power of Team Culture
IT,85,85,cloud engineer,Specialization,google compute engine google app engine gae google cloud platform cloud computing virtual machine network architecture debugging cloud storage data store load balancing virtual private network vpn autoscaling,Information Technology,Architecting with Google Compute Engine Specialization
ECE,85,75,signal processing engineer,Specialization,image segmentation matlab object detection image processing video processing region analysis image filtering,Physical Science and Engineering,Image Processing for Engineering and Science Specialization
MCA,50,50,data analyst,Specialization,text mining python programming pandas matplotlib numpy data cleansing data virtualization data visualization dataviz machine learning ml algorithms machine learning scikitlearn natural language toolkit nltk,Data Science,Applied Data Science with Python Specialization
CSIT,85,85,web developer,Course,bootstrap frontend frameworkresponsive web designjavascriptcascading style sheets css,Computer Science,Advanced Styling with Responsive Design
CS,85,95,data scientist,Specialization,data analysis data visualization dataviz mathematical optimization sql data model data quality regression analysis data cleansing predictive modelling exploratory data analysis simulation business analytics,Business,Advanced Business Analytics Specialization
CS,85,75,machine learning engineer,Specialization,machine learning regression machine learning classification machine learning unsupervised learning exploratory data analysis artificial intelligence ai feature engineering statistical hypothesis testing regression analysis supervised learning linear regression ridge regression,Data Science,IBM Introduction to Machine Learning Specialization
CS,85,95,ai engineer,Course,pedagogyonline learning communityteachinglearninginstructional design,Social Sciences,Online education: The foundations of online teaching
CSAI,85,85,robotics engineer,Course,statisticsbinomial distributiondata analysiscausality,Business,Six Sigma Tools for Analyze
CSIT,85,95,devops engineer,Course,pharmacy healthcare organization operationspublic health and wellness healthcare organization operationsmedical healthcare organization operationshealthcare administrationdental healthcare organization operations,Health,Quality Improvement in Healthcare Organizations
CS,85,95,data scientist,Specialization,codeskulptor data analysis python programming data visualization dataviz python syntax and semantics debugging tuple list label,Computer Science,Introduction to Scripting in Python Specialization
IT,75,85,web developer,Course,react javascript librarydata managementapplication developmentrest apis,Computer Science,Working with Data
CSIT,85,85,devops engineer,Course,data warehousingmicrostrategydata warehousesql,Data Science,Design and Build a Data Warehouse for Business Intelligence Implementation
CS,85,95,data scientist,Course,data sciencedeep learningartificial intelligence aijobsmachine learning,Data Science,Introduction to Artificial Intelligence (AI)
CS,65,65,machine learning engineer,Course,stresscommunicationpresentationpublic speaking,Language Learning,"Speak English Professionally: In Person, Online & On the Phone"
CSAI,85,85,robotics engineer,Specialization,linux kernel programming embedded systems c programming embedded software embedded systems engineering shell script electrical engineering agile software development,Computer Science,Advanced Embedded Linux Development Specialization
ECE,85,85,embedded systems engineer,Course,artificial intelligence aimachine learningreinforcement learningfunction approximationintelligent systems,Data Science,Fundamentals of Reinforcement Learning
CSIT,85,95,web developer,Specialization,data structure problem solving java programming objectoriented programming oop logic programming sorting algorithm trees data structures linked list binary tree graphs search algorithm graph algorithms,Computer Science,Object Oriented Java Programming: Data Structures and Beyond Specialization
IT,85,85,cloud engineer,Specialization,microsoft azure cloud computing cloud computing security artificial intelligence ai internet of things iot application design cloud governance strategy test preparation,Computer Science,Microsoft Azure Fundamentals AZ-900 Exam Prep Specialization
ECE,75,75,iot developer,Professional Certificate,mainframezosenterprise softwaresecurityibm zcobol divisionscobol codingcolumn structurecobol structuresymbolscomputer programmingeulers totient functionintrinsic functionsortingissue tracking systemscrum software developmentinterfacescommandline interface,Computer Science,IBM Mainframe Developer Professional Certificate
CS,85,85,cybersecurity analyst,Course,data modelingdatadrive decision makinggroup decisionmakingdata analysisreport building,Business,Data-Driven Decisions with Power BI
CS,85,85,data scientist,Course,statisticsr programmingrstudioexploratory data analysis,Data Science,Introduction to Probability and Data with R
ECE,85,75,signal processing engineer,Course,customer developmentproduct developmentmarketingproduct managementleadership,Business,Product Management Essentials
MCA,85,85,database administrator,Specialization,data analysis data visualization dataviz mathematical optimization sql data model data quality regression analysis data cleansing predictive modelling exploratory data analysis simulation business analytics,Business,Advanced Business Analytics Specialization
IT,85,85,software engineer,Specialization,software requirements product management scrum agile project management agile software development software product management software project management lean software development software development process scrum software development user story,Computer Science,Software Product Management Specialization
CS,85,85,ai engineer,Specialization,finance trading investment machine learning applied to finance algorithmic trading python programming machine learning reinforcement learning model development reinforcement learning trading algorithm optimization reinforcement learning trading strategy development reinforcement learning trading algo development,Data Science,Machine Learning for Trading Specialization
EN,75,75,control systems engineer,Professional Certificate,cloud nativedevopsiaas paas saashybrid multicloudcloud computingcascading style sheets csshtmlgit softwarejavascriptcloud applicationsdistributed version control drcsopen sourceversion control systemsgithubweb developmentuser interfacereact web frameworkfrontend developmentbackend developmentserverside javascriptexpresscomputer sciencedata sciencepython programmingdata analysispandasnumpyartificial intelligence aiweb applicationapplication developmentflaskdjango web frameworkdatabase dbmssqlkubernetesdockercontainersopenshiftswaggerserverlessmicroservicesrepresentational state transfer restibm code enginenodejs,Information Technology,IBM Full Stack Software Developer Professional Certificate
IT,75,85,software engineer,Course,data analysistableau softwaredata visualization datavizpresentation,Data Science,Share Data Through the Art of Visualization
CS,85,95,data scientist,Specialization,geographic information system gis satellite imagery analysis model building spatial visualization spatial analysis data analysis data visualization dataviz software analytics workflow data management,Data Science,Geographic Information Systems  (GIS) Specialization
CS,85,95,data scientist,Specialization,data science artificial intelligence ai information technology it architecture data architecture leadership deep learning jobs machine learning big data data mining management analytics,Data Science,IBM AI Foundations for Business Specialization
CSIT,85,85,web developer,Course,web designfrontend web developmentuser experience uxaccessibility,Computer Science,Principles of UX/UI Design
CSME,85,85,product design engineer,Course,art historyhistorygraphic artsgraphic design,Arts and Humanities,Ideas from the History of Graphic Design
CS,85,85,software engineer,Course,data analysispredictive analyticsdata visualization datavizdata architecturecoding,Data Science,Introduction to Accounting Data Analytics and Visualization
IT,85,75,data analyst,Course,data analysisdebuggingr programmingrstudio,Data Science,R Programming
CSIT,75,75,software engineer,Course,cluster analysisggplotr programmingexploratory data analysis,Data Science,Exploratory Data Analysis
CSIT,85,95,data scientist,Specialization,data science information engineering artificial intelligence ai machine learning python programming,Data Science,IBM AI Enterprise Workflow Specialization
CS,85,85,software engineer,Course,data sciencedata analysismachine learningproject,Data Science,A Crash Course in Data Science
CS,85,85,ai engineer,Specialization,artificial intelligence ai machine learning management analytics fraud prevention,Business,AI For Business Specialization
IT,85,75,web developer,Specialization,web development react web framework html and css mobile development javascript testdriven development frontend web development objectoriented programming oop linux bash unix shell github version control,Computer Science,Meta React Native Specialization
CSIT,85,75,web developer,Course,web applicationfrontend web developmentreact web frameworkapplication development,Computer Science,React Basics
CSIT,85,85,data scientist,Specialization,data science python programming data analysis pandas numpy jupyter notebooks predictive modelling data visualization dataviz model selection dashboards and charts dash matplotlib,Data Science,Applied Data Science Specialization
ECE,85,95,iot developer,Course,appositiongrammarenglish languageadjective,Language Learning,Adjectives and Adjective Clauses
ECE,75,95,signal processing engineer,Course,playing guitarmusicmusic notationguitar chordsguitar,Arts and Humanities,Guitar Chord Voicings: Playing Up The Neck
CS,85,75,machine learning engineer,Course,tensorflow servingmodel monitoringmodel registriesmachine learning operations mlopsgenerate data protection regulation gdpr,Data Science,Deploying Machine Learning Models in Production
ECE,85,75,signal processing engineer,Course,suffix treesuffix arrayknuthmorrispratt kmp algorithmalgorithms on strings,Computer Science,Algorithms on Strings
CSIT,75,75,devops engineer,Course,client research and analysisbusiness transformationplanning and project managementcommunication and engagementsystems and design thinking,Business,SAP Professional Fundamentals
CSME,85,75,automation engineer,Specialization,linux kernel programming embedded systems c programming embedded software embedded systems engineering shell script electrical engineering agile software development,Computer Science,Advanced Embedded Linux Development Specialization
CSME,85,85,automation engineer,Course,python syntax and semanticsbasic programming languagecomputer programmingpython programming,Computer Science,Programming for Everybody (Getting Started with Python)
ECE,85,75,signal processing engineer,Specialization,credit technology cryptocurrency smart investing blockchain payment systems processing payments payment processing payment technology value propositions decentralization algorithms consensus algorithms blockchain as a business solution,Business,Financial Technology (Fintech) Innovations Specialization
CS,85,95,data scientist,Course,data scienceapache sparkdelta lakesql,Data Science,Distributed Computing with Spark SQL
MCA,85,65,data analyst,Course,data analysistableau softwaredata virtualizationdata visualization dataviz,Data Science,Essential Design Principles for Tableau
CSIT,85,85,devops engineer,Course,tensorflow servingmodel monitoringmodel registriesmachine learning operations mlopsgenerate data protection regulation gdpr,Data Science,Deploying Machine Learning Models in Production
ECE,85,95,signal processing engineer,Course,information security infosecibm new collarmalwarecybersecuritycyber attacks,Information Technology,Introduction to Cybersecurity Tools & Cyber Attacks
CSIT,85,95,devops engineer,Course,particle filterestimationmapping,Physical Science and Engineering,Robotics: Estimation and Learning
CSIT,85,95,data scientist,Specialization,shiny dashboards data analysis and modelling r programmin language data visualization dataviz sql rdbms data science r programming select sql relational databases rdbms data analysis statistical analysis linear regression,Data Science,Applied Data Science with R Specialization
CSIT,85,85,web developer,Course,testdriven developmentjavascriptfrontend web developmentobjectoriented programming oop,Computer Science,Programming with JavaScript
