Branch,Percentage_10th,Percentage_12th,Career_Goal,Course Type,Skills,Category,Title
ECE,85,85,signal processing engineer,Course,cryptocurrencyblockchainsbusiness modeldisruptive innovationinnovation,Business,Blockchain Business Models
CS,85,95,cybersecurity analyst,Specialization,hypothesisdriven development product management design thinking agile lean startup productmarket fit innovation pipeline agile user stories user experience design uxd agile software development software development usability testing,Computer Science,Digital Product Management Specialization
CSME,85,85,automation engineer,Specialization,strategic planning engagement storytelling expense control leadership style training and development setting objectives manage expense control analyze financial statements create a forecast identify capital resources effective use of labor,Business,Introduction to Business Specialization
IT,85,85,web developer,Course,usability testingcontinuous deliveryhypothesisdriven developmentlean startup,Computer Science,Hypothesis-Driven Development
CS,85,75,machine learning engineer,Specialization,big data machine learning deep learning health care graphs unsupervised learning autoencoder,Data Science,Deep Learning for Healthcare Specialization
CSIT,85,75,web developer,Course,web developmentreact web frameworkhtml and cssmobile developmentjavascript,Computer Science,Introduction to Mobile Development
CS,85,85,cybersecurity analyst,Course,change managementcommunicationmanagementcommunications management,Business,Réussir le Changement
CSIT,75,75,software engineer,Course,data sciencemachine learningdatabricks,Data Science,Applied Data Science for Data Analysts
ECE,85,85,vlsi engineer,Course,internetinternet of things iotwirelessfront and back ends,Computer Science,IoT Networking
ECE,75,95,signal processing engineer,Course,agile software developmentlinuxembedded systems,Computer Science,Linux Embedded System Topics and Projects
CS,85,85,data scientist,Course,data sciencemachine learningdatabricks,Data Science,Applied Data Science for Data Analysts
MCA,75,65,software developer,Specialization,software requirements product management scrum agile project management agile software development software product management software project management lean software development software development process scrum software development user story,Computer Science,Software Product Management Specialization
MCA,85,85,database administrator,Specialization,data science relational database management system rdbms cloud databases python programming sql deep learning machine learning big data data mining github jupyter notebooks rstudio,Data Science,Introduction to Data Science Specialization
MCA,75,65,software developer,Specialization,software development process algorithms software engineering c programming computer programming programming language concepts problem solving compiler debugging,Computer Science,Introductory C Programming Specialization
CS,85,85,cybersecurity analyst,Specialization,security management network security risk management security governance computer security incident management security vulnerabilities and treatments threats to cybersecurity cybersecurity terminology cybersecurity program elements cybersecurity planning cybersecurity performance measurement risk identification,Information Technology,Managing Cybersecurity Specialization
CS,85,85,software engineer,Course,data sciencedeep learningmachine learningbig datadata mining,Data Science,What is Data Science? 
IT,85,85,cloud engineer,Course,ibm powervcinfrastructure as a serviceopenstackcloud computingibm cloud,Information Technology,Private Cloud Management on IBM Power Systems
CS,65,65,machine learning engineer,Course,professionalemail writingcommunicationwriting,Language Learning,Write Professional Emails in English
ECE,75,75,iot developer,Course,strategic thinkingdesign thinkinginnovation managementdesign managementinnovation,Business,Design Thinking for Innovation
ECE,85,75,signal processing engineer,Course,hyperledgermicrosoft azureblockchain platformsgridaugur,Computer Science,Blockchain Platforms
CS,75,85,data scientist,Specialization,data science data management data analysis communication leadership machine learning project team building management team management interpretation exploratory data analysis,Data Science,Executive Data Science Specialization
ECE,75,95,signal processing engineer,Specialization,describe how to work with relational data on azure describe core data concepts describe how to work with nonrelational data on azure describe an analytics workload on azure microsoft azure data management data storage data concepts database dbms nosql sql relational data,Data Science,Microsoft Azure Data Fundamentals DP-900 Exam Prep Specialization
CSIT,85,95,devops engineer,Course,data managementgoogle dataflowgoogle bigqueryextraction transformation and loading etldatabase optimizationdata transformation,Data Science,The Path to Insights: Data Models and Pipelines
CS,85,95,ai engineer,Specialization,artificial neural network convolutional neural network tensorflow recurrent neural network transformers deep learning backpropagation python programming neural network architecture mathematical optimization hyperparameter tuning inductive transfer,Data Science,Deep Learning Specialization
CSME,85,75,ai in manufacturing,Course,statistical data bias detectionmulticlass classification with fasttext and blazingtextdata ingestionexploratory data analysisautomated machine learning automl,Data Science,Analyze Datasets and Train ML Models using AutoML
IT,85,85,web developer,Course,react javascript libraryreactapplication developmentmobile development,Computer Science,React Native
MCA,75,65,software developer,Course,data sciencedata analysismachine learning,Data Science,Data Science Fundamentals for Data Analysts
CSIT,85,95,data scientist,Course,data sciencer programmingdata visualization datavizlinear regressionexploratory data analysis,Data Science,Data Science with R - Capstone Project
CSIT,85,85,web developer,Course,number theorycryptographymodular exponentiation,Computer Science,Number Theory and Cryptography
ECE,75,75,iot developer,Course,capital budgetingrisk analysisprojectfinance,Business,Financing and Investing in Infrastructure
CSIT,75,75,devops engineer,Course,app behaviors and automationapplication and data access controlapp authoring and collaborationexternal service integrationapp version management,Information Technology,Building No-Code Apps with AppSheet: Implementation
IT,85,85,software engineer,Specialization,data clustering algorithms text mining data visualization dataviz data mining data visualization software tableau software data virtualization information retrieval ir document retrieval machine learning recommender systems probabilistic models,Data Science,Data Mining  Specialization
ECE,85,75,signal processing engineer,Course,aws identity and access managementnetworking on awsaws management consolecloud computingaws security,Information Technology,AWS Cloud Technical Essentials
EN,85,85,power systems engineer,Course,human resources hrresource managementhr strategy,Business,Preparing to Manage Human Resources
IT,85,85,web developer,Course,natural language processinglong short term memory lstmgated recurrent unit grurecurrent neural networkattention models,Data Science,Sequence Models
CSIT,85,95,data scientist,Specialization,storyboarding map tableau software data visualization dataviz data virtualization visualization computer graphics data analysis visual analytics interactive visualization,Data Science,Data Visualization with Tableau Specialization
IT,85,85,cloud engineer,Specialization,google compute engine google app engine gae google cloud platform cloud computing,Information Technology,Architecting with Google Kubernetes Engine Specialization
CS,85,95,software engineer,Course,data sciencemethodologycrispdmdata analysisdata mining,Data Science,Data Science Methodology
CS,75,85,data scientist,Specialization,shiny dashboards data analysis and modelling r programmin language data visualization dataviz sql rdbms data science r programming select sql relational databases rdbms data analysis statistical analysis linear regression,Data Science,Applied Data Science with R Specialization
ECE,85,75,signal processing engineer,Specialization,credit technology cryptocurrency smart investing blockchain payment systems processing payments payment processing payment technology value propositions decentralization algorithms consensus algorithms blockchain as a business solution,Business,Financial Technology (Fintech) Innovations Specialization
ME,75,75,design engineer,Specialization,storyboarding heuristic evaluation r programming ab testing rapid prototyping paper prototyping user experience ux user experience design uxd user interface user research persona user experience humancomputer interaction,Computer Science,Interaction Design Specialization
MCA,65,50,data analyst,Course,data sciencer programming,Data Science,Introduction to R Programming for Data Science
CSIT,85,75,web developer,Course,marketingbrand managementstrategic planningvalue proposition,Social Sciences,Trademark Law
CSIT,85,85,devops engineer,Course,effect modifcationproportional hazards modelregression analysisspline approach,Health,Multiple Regression Analysis in Public Health 
MCA,50,50,data analyst,Specialization,data analysis apache spark delta lake sql data science sqlite ab testing query string predictive analytics presentation skills creating metrics exploratory data analysis,Data Science,Learn SQL Basics for Data Science Specialization
CSIT,75,85,devops engineer,Course,business psychologyworkplace inclusionbusiness communicationleadership developmentteam management,Business,"Diversity, Equity, and Inclusion Best Practices for Managers"
IT,85,85,web developer,Course,pharmacy healthcare organization operationspublic health and wellness healthcare organization operationsmedical healthcare organization operationshealthcare administrationdental healthcare organization operations,Health,Health Care Delivery in Healthcare Organizations
CSME,85,75,automation engineer,Course,software testingformal verificationtest automation,Computer Science,Introduction to Automated Analysis
CSIT,85,75,web developer,Specialization,software architecture java software design pattern objectoriented programming oop objectoriented design objectoriented analysis and design unified modeling language uml web service microservices representational state transfer rest serviceoriented architecture,Computer Science,Software Design and Architecture Specialization
CS,85,85,data scientist,Course,statisticsr programmingrstudioexploratory data analysis,Data Science,Introduction to Probability and Data with R
ECE,85,75,signal processing engineer,Course,health informaticsnutritionfood safetyfood science,Health,Stanford Introduction to Food and Health
CS,85,85,machine learning engineer,Course,data sciencedeep learningartificial intelligence aijobsmachine learning,Data Science,Introduction to Artificial Intelligence (AI)
CS,85,95,data scientist,Course,data analysiscommunicationinterpretationexploratory data analysis,Business,Managing Data Analysis
ECE,85,95,signal processing engineer,Course,statisticslinear regressionr programmingregression analysis,Data Science,Linear Regression and Modeling 
CS,85,95,software engineer,Course,python programmingmachine learning conceptsmachine learningdeep learning,Data Science,Machine Learning Foundations: A Case Study Approach
ME,75,75,design engineer,Course,manufacturing process managementcomputeraided design cadcomputeraided manufacturingautodesk fusion mechanical engineering,Physical Science and Engineering,3-Axis Machining with Autodesk Fusion 360
CSAI,85,95,robotics engineer,Course,product developmentprototypingproduct managementproduct designuser experience ux,Business,"Creative Design, Prototyping, and Testing"
MCA,65,50,web developer,Course,selfassessmentskills managementselfcoachingcompetence human resourcescompetitiveness,Personal Development,Building and Managing Superior Skills
CSIT,85,95,data scientist,Course,data sciencedeep learningartificial intelligence aijobsmachine learning,Data Science,Introduction to Artificial Intelligence (AI)
CSIT,85,85,web developer,Course,web designweb accessibilityhtmlhtml,Computer Science,Introduction to HTML5
CSIT,85,85,devops engineer,Specialization,artificial intelligence ai digital design manufacturing engineer industry,Physical Science and Engineering,Digital Manufacturing & Design Technology  Specialization
MCA,75,65,web developer,Course,basic python data structuresfundamental programming conceptsbasic python syntaxpython programmingobjectoriented programming oop,Information Technology,Crash Course on Python
CS,85,95,data scientist,Course,data analysistableau softwaredata visualization datavizpresentation,Data Science,Share Data Through the Art of Visualization
ECE,75,95,signal processing engineer,Specialization,tensorflow keras tensorflow probability probabilistic neural networks deep learning probabilistic neural network generative model probabilistic programming language prpl,Data Science,TensorFlow 2 for Deep Learning Specialization
CS,75,75,software engineer,Course,data scienceinformation engineeringartificial intelligence aimachine learningpython programming,Data Science,AI Workflow: Business Priorities and Data Ingestion
MCA,75,65,software developer,Course,data analysistableau softwaredata visualization datavizpresentation,Data Science,Share Data Through the Art of Visualization
CSIT,85,85,devops engineer,Specialization,active listening communication management crosscultural communication assertiveness collaboration,Business,Conflict Management Specialization
CSIT,85,95,data scientist,Course,python programmingtableau softwaredata visualization datavizeffective communicationexploratory data analysis,Data Science,Go Beyond the Numbers: Translate Data into Insights
CS,85,85,data scientist,Course,data analysismysqlteradatasql,Data Science,Managing Big Data with MySQL
ECE,75,75,embedded systems engineer,Professional Certificate,manage azure resources for machine learningdeploy and operationalize machine learning solutionsrun experiments and train modelsimplement responsible machine learning,Computer Science,Microsoft Azure Data Scientist Associate (DP-100)  Professional Certificate
ECE,85,75,signal processing engineer,Course,programming principlesinterfacessoftware designjava programming,Computer Science,Java Programming: Principles of Software Design
ECE,85,85,vlsi engineer,Course,delegationpersonal brandingleadershipmanagement,Business,Professional Skills for International Business
ECE,85,95,iot developer,Course,confidencepresentationspeechpublic speaking,Business,Introduction to Public Speaking
CSIT,75,85,devops engineer,Course,digital marketing kpisspreadsheet managementpresenting to stakeholdersmedia planning and strategiesmarketing analytics,Business,Assess for Success: Marketing Analytics and Measurement
CSAI,85,95,robotics engineer,Course,functional apicustom layerscustom and exotic models with functional apicustom loss functions,Data Science,"Custom Models, Layers, and Loss Functions with TensorFlow"
MCA,85,65,data analyst,Course,data sciencedeep learningmachine learningbig datadata mining,Data Science,What is Data Science? 
CS,85,95,data scientist,Course,data sciencer programmingdata visualization datavizlinear regressionexploratory data analysis,Data Science,Data Science with R - Capstone Project
CSME,85,75,automation engineer,Course,computer programmingalgorithmsprogramming languagescratch programming language,Computer Science,Code Yourself! An Introduction to Programming
ECE,75,95,signal processing engineer,Course,file shortcutemailsignatureconfidentiality,Information Technology,Gmail en Español
IT,85,85,web developer,Course,bootstrap frontend frameworkresponsive web designjavascriptcascading style sheets css,Computer Science,Advanced Styling with Responsive Design
IT,85,85,cloud engineer,Course,cloud nativedevopsiaas paas saashybrid multicloudcloud computing,Information Technology,Introduction to Cloud Computing
CS,85,75,machine learning engineer,Specialization,predictive modelling financial engineering machine learning tensorflow reinforcement learning option pricing and risk management simple model for market dynamics qlearning using financial problems optimal trading portfolio optimization,Data Science,Machine Learning and Reinforcement Learning in Finance Specialization
ECE,85,95,signal processing engineer,Specialization,artificial intelligence ai digital design manufacturing engineer industry,Physical Science and Engineering,Digital Manufacturing & Design Technology  Specialization
ECE,85,75,signal processing engineer,Professional Certificate,unityjavascript codingmeta sparkvuforiac coding,Computer Science,Meta AR Developer  Professional Certificate
IT,85,75,data analyst,Specialization,data science python programming data analysis pandas numpy jupyter notebooks predictive modelling data visualization dataviz model selection dashboards and charts dash matplotlib,Data Science,Applied Data Science Specialization
MCA,65,50,web developer,Course,business modelenvironmental policybusiness analysismaterial designpolicy analysis,Physical Science and Engineering,Circular Economy - Sustainable Materials Management
CSIT,85,75,software engineer,Specialization,programming principles python programming java programming data structure computer programming python tools python syntax and semantics data science python libraries data analysis data visualization dataviz java tools,Computer Science,Introduction to Programming with Python and Java Specialization
MCA,75,65,web developer,Course,leading and managing change in organisationsupportive communicationleading subordinates effectivelymindfulnesspositive personality,Business,Leadership Skills
IT,85,85,software engineer,Specialization,data analysis microsoft excel data visualization dataviz data cleansing big data power bi,Business,Excel Skills for Data Analytics and Visualization Specialization
IT,75,75,data analyst,Course,data sciencemachine learningr programmingnatural language processing,Data Science,Data Science Capstone
ECE,85,85,vlsi engineer,Course,renewable energypower energy calculationselectronic circuitssolar energyenergy audits,Physical Science and Engineering,Solar Energy Basics
ME,75,75,design engineer,Specialization,audio recording music music production sound design audio editing audio production songwriting music recording midi pro tools music editing music mixing,Arts and Humanities,Music Production Specialization
CS,85,75,machine learning engineer,Course,data sciencedeep learningartificial intelligence aijobsmachine learning,Data Science,Introduction to Artificial Intelligence (AI)
ECE,85,75,signal processing engineer,Specialization,vision alignment talent management goals and rewards motivate employees leadership goal setting communication leadership development onboarding coaching recruitment management,Business,Leading People and Teams Specialization
CSIT,85,75,web developer,Specialization,html javascript cascading style sheets css java programming html algorithms problem solving string computer science data structure cryptography hash table programming principles,Computer Science,Java Programming and Software Engineering Fundamentals Specialization
CSIT,75,75,software engineer,Specialization,data clustering algorithms text mining data visualization dataviz data mining data visualization software tableau software data virtualization information retrieval ir document retrieval machine learning recommender systems probabilistic models,Data Science,Data Mining  Specialization
ECE,75,75,iot developer,Course,interest ratemodel calibrationproduct pricingoption,Business,Computational Methods in Pricing and Model Calibration
CS,85,75,machine learning engineer,Specialization,big data neoj mongodb apache spark apache hadoop mapreduce cloudera data model data modeling data management splunk machine learning concepts,Data Science,Big Data Specialization
CS,85,95,cybersecurity analyst,Specialization,cryptography cybersecurity risk assessment cyber defense cyber attacks information security infosec denialofservice attack dos publickey cryptography,Computer Science,Introduction to Cyber Security Specialization
CSIT,85,85,web developer,Course,information designuser interface techniquesresponsive web designwebsite wireframe,Computer Science,Information Design
ECE,85,75,signal processing engineer,Course,grammarkorean languagespeechwriting,Language Learning,First Step Korean
MCA,50,50,data analyst,Course,data sciencegithubr programmingrstudio,Data Science,The Data Scientist’s Toolbox
CSIT,85,85,web developer,Course,web developmentbackend developmentserverside javascriptexpresscomputer science,Computer Science,Developing Cloud Apps with Node.js and React
CSIT,85,75,web developer,Specialization,lean software development kanban agile software development software development process software development kit sdk scrum software development application security software architecture software testing software design software quality,Computer Science,Software Development Lifecycle Specialization
CSIT,85,85,web developer,Course,web development toolsuser interfacefrontend web developmenthtml and cssresponsive web design,Computer Science,Introduction to Front-End Development
ECE,85,95,signal processing engineer,Specialization,json database dbms natural language processing sql,Computer Science,PostgreSQL for Everybody Specialization
CSIT,85,95,devops engineer,Course,business analyticsr programmingrstudio,Business,Introduction to Business Analytics with R
CSAI,85,85,robotics engineer,Specialization,shell script bash unix shell linux cloud databases python programming jupyter notebooks relational database management system rdbms sql extraction transformation and loading etl apache kafka apache airflow data pipelines,Information Technology,"BI Foundations with SQL, ETL and Data Warehousing Specialization"
CS,85,95,software engineer,Specialization,runtime analysis algorithms hash table trees data structures objectoriented programming oop,Computer Science,Accelerated Computer Science Fundamentals Specialization
CS,85,85,data scientist,Course,data analysiscommunicationinterpretationexploratory data analysis,Business,Managing Data Analysis
ECE,85,85,vlsi engineer,Course,autodeskcomputeraided design cadfusion mechanical engineeringmodeling,Physical Science and Engineering,Modeling and Design for Mechanical Engineers with Autodesk Fusion 360
CS,85,95,cybersecurity analyst,Course,linear regressionridge regressionlasso statisticsregression analysis,Data Science,Machine Learning: Regression
CS,65,65,machine learning engineer,Course,statistical data bias detectionmulticlass classification with fasttext and blazingtextdata ingestionexploratory data analysisautomated machine learning automl,Data Science,Analyze Datasets and Train ML Models using AutoML
CSIT,85,85,data scientist,Specialization,github machine learning r programming regression analysis data science rstudio data analysis debugging data manipulation regular expression regex data cleansing cluster analysis,Data Science,Data Science Specialization
CSIT,85,75,web developer,Course,ux and uireact web frameworkgithubfigmasql,Computer Science,Capstone (React App)
CS,85,95,data scientist,Course,data sciencepython programmingdata analysispandasnumpy,Data Science,"Python for Data Science, AI & Development"
CS,85,85,data scientist,Course,data sciencegithubr programmingrstudio,Data Science,The Data Scientist’s Toolbox
MCA,75,65,web developer,Specialization,product development ideation product management product design innovation market analysis entrepreneurship competitive analysis customer development marketing leadership user experience ux,Business,"Product Ideation, Design, and Management Specialization"
CS,85,75,machine learning engineer,Course,teachingenglish languagelesson planplan,Language Learning,Teach English Now! Technology Enriched Teaching
CS,85,95,ai engineer,Course,text analysisbasic time series analysismachine learning model evaluation and optimizationpython programmingmachine learning modeling,Data Science,Machine Learning for Accounting with Python
CS,85,85,data scientist,Course,data sciencedata analysissqlitesql,Data Science,SQL for Data Science
CS,85,85,ai engineer,Course,communicationenglish languagecareer developmentwriting,Language Learning,English for Career Development
CS,85,95,data scientist,Course,data sciencedeep learningartificial intelligence aijobsmachine learning,Data Science,Introduction to Artificial Intelligence (AI)
CS,65,65,machine learning engineer,Specialization,model interpretation image segmentation natural language extraction machine learning timetoevent modeling deep learning model evaluation multiclass classification random forest model tuning treatment effect estimation machine learning interpretation,Data Science,AI for Medicine Specialization
CS,85,85,data scientist,Course,data sciencedata analysisdata visualization datavizr programming,Data Science,Data Visualization with R
ECE,85,85,vlsi engineer,Specialization,marketing plan market research positioning marketing value proposition consumer behaviour data analysis market segmentation marketing process market analysis planning marketing strategy,Business,Marketing Strategy Specialization
MCA,85,65,data analyst,Specialization,data science spreadsheet microsoft excel data analysis data visualization dataviz pivot table ibm cognos analytics dashboard,Data Science,Data Analysis and Visualization Foundations Specialization
